{
  "$schema": "https://json-schema.org/draft/2020-12/schema",
  "title": "Hex Workplan",
  "description": "A workplan decomposes a feature into dependency-ordered phases of tasks. Each task maps to one hexagonal adapter boundary. Workplans are stored in docs/workplans/ and executed by HexFlo swarms.",
  "type": "object",
  "required": ["id", "feature", "adr", "status", "phases"],
  "properties": {
    "id": {
      "type": "string",
      "pattern": "^wp-",
      "description": "Unique identifier, prefixed wp-. Example: wp-frontend-hexagonal-architecture"
    },
    "feature": {
      "type": "string",
      "description": "Human-readable feature name — displayed in hex plan list"
    },
    "description": {
      "type": "string",
      "description": "What this workplan delivers and why"
    },
    "adr": {
      "type": "string",
      "pattern": "^ADR-\\d+",
      "description": "ADR reference (ADR-NNN legacy or ADR-YYMMDDHHMM timestamp). Required by ADR-050 pipeline: ADR → Workplan → Swarm"
    },
    "status": {
      "type": "string",
      "enum": ["planned", "in_progress", "done", "superseded"],
      "description": "Workplan lifecycle status. planned=not started, in_progress=active work, done=all phases complete, superseded=replaced by another workplan"
    },
    "priority": {
      "type": "string",
      "enum": ["P0-BLOCKER", "high", "normal"],
      "description": "P0-BLOCKER blocks other work and shows red in hex plan list"
    },
    "blocks": {
      "type": "array",
      "items": { "type": "string" },
      "description": "What this workplan blocks (shown when priority is P0-BLOCKER)"
    },
    "created_at": {
      "type": "string",
      "format": "date-time",
      "description": "ISO 8601 creation timestamp"
    },
    "created_by": {
      "type": "string",
      "enum": ["planner", "human", "hex-coder"],
      "description": "Who created this workplan"
    },
    "supersedes": {
      "type": "string",
      "description": "ID of workplan this one replaces"
    },
    "supersession_reason": {
      "type": "string",
      "description": "Why the old plan was absorbed"
    },
    "relates_to": {
      "type": "string",
      "description": "ID of related workplan"
    },
    "phases": {
      "type": "array",
      "description": "Execution phases ordered by dependency tier. Phases execute sequentially; tasks within a phase can run in parallel.",
      "items": {
        "type": "object",
        "required": ["id", "name", "tasks"],
        "properties": {
          "id": {
            "type": "string",
            "pattern": "^P\\d+$",
            "description": "Phase identifier: P0, P1, P2..."
          },
          "name": {
            "type": "string",
            "description": "What this phase delivers"
          },
          "tier": {
            "type": "integer",
            "minimum": 0,
            "maximum": 5,
            "description": "Dependency tier: 0=domain/ports, 1=secondary adapters, 2=primary adapters, 3=usecases, 4=integration/tests"
          },
          "description": {
            "type": "string",
            "description": "Detailed phase scope and acceptance criteria"
          },
          "gate": {
            "type": "object",
            "description": "Build/test gate that must pass before next phase starts",
            "properties": {
              "type": {
                "type": "string",
                "enum": ["build", "typecheck", "lint", "test"],
                "description": "Gate type"
              },
              "command": {
                "type": "string",
                "description": "Shell command to run as gate check"
              },
              "blocking": {
                "type": "boolean",
                "description": "If true, workplan halts on gate failure"
              }
            },
            "required": ["type", "command", "blocking"]
          },
          "tasks": {
            "type": "array",
            "description": "Tasks within this phase. Tasks with no inter-deps can run in parallel.",
            "items": {
              "type": "object",
              "required": ["id", "name", "layer"],
              "properties": {
                "id": {
                  "type": "string",
                  "pattern": "^P\\d+\\.\\d+$",
                  "description": "Task identifier: P1.1, P2.3..."
                },
                "name": {
                  "type": "string",
                  "description": "Single deliverable this task produces"
                },
                "layer": {
                  "type": "string",
                  "enum": ["domain", "ports", "primary", "secondary"],
                  "description": "Hex architecture layer this task operates in"
                },
                "description": {
                  "type": "string",
                  "description": "Implementation details, acceptance criteria, key decisions"
                },
                "deps": {
                  "type": "array",
                  "items": { "type": "string" },
                  "description": "Task IDs this task depends on. Empty = can start immediately."
                },
                "files": {
                  "type": "array",
                  "items": { "type": "string" },
                  "description": "Files this task will create or modify"
                },
                "status": {
                  "type": "string",
                  "enum": ["todo", "in_progress", "done", "partial"],
                  "description": "Task execution status"
                },
                "agent": {
                  "type": "string",
                  "enum": ["hex-coder", "planner", "integrator", "reviewer"],
                  "description": "Agent role to execute this task"
                },
                "strategy_hint": {
                  "type": "string",
                  "enum": ["scaffold", "transform", "script", "codegen", "inference"],
                  "description": "Execution strategy hint (ADR-2026-04-13-1630). scaffold=template codegen, transform=AST transform, script=run command, codegen=code gen (template first, inference fallback), inference=requires LLM reasoning. Absent=auto-classify from task title."
                }
              }
            }
          }
        }
      }
    }
  },
  "examples": [
    {
      "id": "wp-example",
      "feature": "Example Feature",
      "description": "Demonstrates the workplan format",
      "adr": "ADR-001",
      "status": "planned",
      "created_at": "2026-01-01T00:00:00Z",
      "created_by": "planner",
      "phases": [
        {
          "id": "P1",
          "name": "Port Interfaces",
          "tier": 0,
          "gate": { "type": "typecheck", "command": "cargo check", "blocking": true },
          "tasks": [
            {
              "id": "P1.1",
              "name": "Define port trait",
              "layer": "ports",
              "deps": [],
              "files": ["src/ports/example.rs"],
              "agent": "hex-coder"
            }
          ]
        }
      ]
    }
  ]
}
