{
  "id": "wp-spacetimedb-per-module-databases",
  "feature": "SpacetimeDB Per-Module Databases",
  "description": "Migrate from single-database publishing to per-module databases so all 18 WASM modules can be hydrated. Includes fixing stale binary detection, hydration status reporting, and gitignore for ADRs.",
  "adr": "ADR-2603231500",
  "status": "done",
  "priority": "high",
  "blocks": ["chat-relay", "inference-gateway", "secret-grant", "workplan-state tracking"],
  "created_at": "2026-03-23T14:00:00Z",
  "created_by": "planner",
  "phases": [
    {
      "id": "P0",
      "name": "Quick fixes — binary priority, hydration status, gitignore",
      "tier": 0,
      "description": "Three small fixes that are independent of the per-module migration and unblock developer ergonomics immediately.",
      "gate": {
        "type": "build",
        "command": "cargo check -p hex-cli -p hex-nexus",
        "blocking": true
      },
      "tasks": [
        {
          "id": "P0.1",
          "name": "Fix find_nexus_binary() priority order",
          "layer": "primary",
          "description": "Check target/debug and target/release BEFORE PATH lookup so stale-binary detection works during development. Current order: env var → PATH → local builds. New order: env var → local builds → PATH.",
          "deps": [],
          "files": ["hex-cli/src/commands/nexus.rs"],
          "status": "done",
          "agent": "hex-coder"
        },
        {
          "id": "P0.2",
          "name": "Fix HydrationResult::status() for single-tier",
          "layer": "secondary",
          "description": "status() returns 'hydrated' when all active tier modules publish successfully. Currently checks schema_verified which may fail even when all tiers succeed. Also update the CLI output to not show dormant tiers as failures.",
          "deps": [],
          "files": ["hex-nexus/src/spacetime_launcher.rs", "hex-cli/src/commands/stdb.rs"],
          "status": "done",
          "agent": "hex-coder"
        },
        {
          "id": "P0.3",
          "name": "Un-gitignore docs/adrs/",
          "layer": "primary",
          "description": "Remove or amend the docs gitignore pattern so ADRs can be git-added without -f. Check .gitignore for the pattern and fix it.",
          "deps": [],
          "files": [".gitignore"],
          "status": "done",
          "agent": "hex-coder"
        },
        {
          "id": "P0.4",
          "name": "Kill stuck spacetimedb-update processes",
          "layer": "primary",
          "description": "ensure_spacetimedb() should detect and kill hung spacetimedb-update processes that block spacetime version calls. Add a timeout-based cleanup before attempting spacetime start.",
          "deps": [],
          "files": ["hex-cli/src/commands/nexus.rs"],
          "status": "done",
          "agent": "hex-coder"
        }
      ]
    },
    {
      "id": "P1",
      "name": "Database name constants in hex-core",
      "tier": 0,
      "description": "Define canonical database names for all 18 modules as constants in hex-core so all crates share the same names. Each module's database name matches its directory name.",
      "gate": {
        "type": "build",
        "command": "cargo check -p hex-core",
        "blocking": true
      },
      "tasks": [
        {
          "id": "P1.1",
          "name": "Add SPACETIMEDB_MODULE_DATABASES constant map",
          "layer": "domain",
          "description": "Add a const array or module mapping each WASM module name to its database name in hex-core/src/lib.rs. Database name = directory name for all modules except hexflo-coordination which stays as 'hex' for backward compat.",
          "deps": [],
          "files": ["hex-core/src/lib.rs"],
          "status": "done",
          "agent": "hex-coder"
        }
      ]
    },
    {
      "id": "P2",
      "name": "Per-module publish in spacetime_launcher",
      "tier": 1,
      "description": "Update publish_module() and publish_modules_ordered() to use per-module database names. Restore MODULE_TIERS with all 18 modules.",
      "gate": {
        "type": "build",
        "command": "cargo check -p hex-nexus",
        "blocking": true
      },
      "tasks": [
        {
          "id": "P2.1",
          "name": "Update publish_module() to accept database name per module",
          "layer": "secondary",
          "description": "Change the free function publish_module(host, database, module_path) to derive the database name from the module directory name. hexflo-coordination → 'hex', all others → directory name. Update SpacetimeLauncher::publish_modules() similarly.",
          "deps": ["P1.1"],
          "files": ["hex-nexus/src/spacetime_launcher.rs"],
          "status": "done",
          "agent": "hex-coder"
        },
        {
          "id": "P2.2",
          "name": "Restore MODULE_TIERS with all 18 modules",
          "layer": "secondary",
          "description": "Re-enable all 4 tiers in MODULE_TIERS. Each module publishes to its own database so schema conflicts are impossible. Keep hexflo-coordination in tier 0.",
          "deps": ["P2.1"],
          "files": ["hex-nexus/src/spacetime_launcher.rs"],
          "status": "done",
          "agent": "hex-coder"
        }
      ]
    },
    {
      "id": "P3",
      "name": "Update nexus adapters to use constants",
      "tier": 1,
      "description": "Replace hardcoded database name defaults in nexus adapters with hex-core constants. Env var overrides remain.",
      "gate": {
        "type": "build",
        "command": "cargo check -p hex-nexus",
        "blocking": true
      },
      "tasks": [
        {
          "id": "P3.1",
          "name": "Update spacetime_inference adapter default database",
          "layer": "secondary",
          "description": "Replace hardcoded 'inference-gateway' default with hex_core constant.",
          "deps": ["P1.1"],
          "files": ["hex-nexus/src/adapters/spacetime_inference.rs", "hex-nexus/src/lib.rs"],
          "status": "done",
          "agent": "hex-coder"
        },
        {
          "id": "P3.2",
          "name": "Update spacetime_chat adapter default database",
          "layer": "secondary",
          "description": "Replace hardcoded 'chat-relay' default with hex_core constant.",
          "deps": ["P1.1"],
          "files": ["hex-nexus/src/adapters/spacetime_chat.rs", "hex-nexus/src/lib.rs"],
          "status": "done",
          "agent": "hex-coder"
        },
        {
          "id": "P3.3",
          "name": "Update spacetime_secrets adapter default database",
          "layer": "secondary",
          "description": "Replace hardcoded 'hex-nexus' default with hex_core constant for secret-grant module.",
          "deps": ["P1.1"],
          "files": ["hex-nexus/src/adapters/spacetime_secrets.rs", "hex-nexus/src/lib.rs"],
          "status": "done",
          "agent": "hex-coder"
        },
        {
          "id": "P3.4",
          "name": "Update spacetime_session adapter default database",
          "layer": "secondary",
          "description": "Replace hardcoded 'chat-relay' default with hex_core constant for session persistence.",
          "deps": ["P1.1"],
          "files": ["hex-nexus/src/adapters/spacetime_session.rs", "hex-nexus/src/lib.rs"],
          "status": "done",
          "agent": "hex-coder"
        }
      ]
    },
    {
      "id": "P4",
      "name": "Full hydration test and validation",
      "tier": 4,
      "description": "End-to-end test: hydrate all 18 modules, verify each database exists with correct tables, run parity check on all subsystems.",
      "gate": {
        "type": "test",
        "command": "hex stdb hydrate && hex nexus status && hex swarm status && hex task list && hex inbox list",
        "blocking": true
      },
      "tasks": [
        {
          "id": "P4.1",
          "name": "Full hydration — all 18 modules published",
          "layer": "secondary",
          "description": "Run hex stdb hydrate and verify all 4 tiers report success. Check hex stdb status shows all 18 modules with checkmarks.",
          "deps": ["P2.2", "P3.1", "P3.2", "P3.3", "P3.4"],
          "files": [],
          "status": "done",
          "agent": "integrator"
        },
        {
          "id": "P4.2",
          "name": "Parity validation — all subsystems green",
          "layer": "secondary",
          "description": "Verify: project list, swarm status, task list, inbox, inference endpoints, session persistence all work against their respective databases.",
          "deps": ["P4.1"],
          "files": [],
          "status": "done",
          "agent": "integrator"
        }
      ]
    }
  ]
}
